"Inca Dawn","Tubers have good  resistance to splitting and weak  resistance to bruising.Â Â Trials have found good resistance to potato virus Yo  and common scab.Â Â Tests for resistance to potato cyst nematode demonstrated susceptibility to both <i>Globodera rostochiensis</i> Ro1  and <i>Globodera pallida</i> Pa 2/3, 1.","SCRI 80CP23 x SCRI 71T46",1,"Scottish Crop Research Institute",Invergowrie,,Dundee,,"DD2 5DA","UNITED KINGDOM",,www.scri.sari.ac.uk,"+44 (0)1382 562731",,-,-,-,-,-,-,-,-,-,-,-,2033,"Oval - long","Red parti-coloured","Deep yellow","Medium - deep",Smooth,Pink,Maincrop,Short,"Red violet",Many,1,7,7,-,-,-,3,3,2,8,5,-,-,-,-,-,5,4,6,-,-,-,-
"Inca Rosa",,"Stirling x Inca Bella",1,"James Hutton Institute",Mylnefield,Invergowrie,Dundee,,"DD2 5DA","UNITED KINGDOM",,,"+44(0)1382 562731","+44(0)1382 562426",-,-,-,-,-,-,-,-,-,-,-,-,Oval,Yellow,"Medium yellow",Shallow,-,Pink,"Early Maincrop","Medium - tall",-,-,6,6,-,1,9,7,1,1,2,7,5,1,7,7,4,5,6,1,-,-,-,-,-
Infinity,"Tubers have good resistance to splitting.Â Â Trials have found good resistance to blackleg, dry rot (<I>Fusarium coeruleum</I>) and potato mop top (spraing).Â Â This variety has low resistance to late blight on tubers.Â Â Tests for resistance to potato cyst nematode demonstrated susceptibility to both <i>Globodera rostochiensis</i> Ro1  and <i>Globodera pallida</i> Pa 2/3, 1.","Lady Rosetta x Rooster",1,"Teagasc Crops Research Centre","Oak Park Research Centre",,Carlow,,,IRELAND,,www.teagasc.ie,"+353 59 9170200","+353 59 9142423","Irish Potato Marketing Ltd","East Den Brae",,Letham,Angus,"DD8 2PJ","UNITED KINGDOM",info@ipmscotland.co.uk,www.ipm.ie,"+44 (0)1307 818121","+44 (0)1307 818131",-,"Short - oval",Red,Cream,Shallow,-,-,"Early Maincrop",-,-,-,5,7,-,-,-,-,-,2,2,5,7,6,9,5,4,6,5,2,4,-,-,-,-
Innovator," Innovator is a russet skinned variety for the French fry market.","Shepody x RZ-84-2580",1,"HZPC Holland B.V.","Box 88",NL-8500,"AB Joure",,,NETHERLANDS,,,,,"HZPC UK Limited","2 Wharf Road",Crowle,Scunthorpe,"North Lincolnshire","DN17 4HS","UNITED KINGDOM",info.uk@hzpc.com,www.hzpc.co.uk,"+44 (0)1724 71 00 33","+44 (0)1724 71 00 99",2028,"Oval - long",Russet,"Light yellow",-,Rough,Absent,"Second Early",-,White,-,6,5,-,-,-,8,-,8,2,6,5,1,8,5,6,9,7,1,3,-,-,-,-
"International Kidney","This variety has low resistance to late blight on foliage and late blight on tubers..",-,1,-,-,-,-,-,-,-,-,-,-,-,"GB Seed Industry","These varieties are freely available and","sources can be found by clicking on the","national flags on each","variety description page.",,"UNITED KINGDOM",,,,,-,"Oval - long",White,"Light yellow",Shallow,Smooth,Blue,"Second Early",Medium,White,Absent,-,-,-,-,-,-,6,-,-,-,-,-,-,-,-,-,-,2,2,-,-,-,-
"Isle Of Jura","Isle of Jura is suitable for the pre-pack, general ware and export markets thanks to excellent flavour.  Large tuber numbers allow high yield of 45x65mm ware.  It has medium dry matter and boils extremely well.  Good resistance to powdery scab, blackleg, gangrene, potato virus Yo and spraing.  tests show susceptibility to  Black dot, Dry rot <i> Fusarium coeruleum </i> and <i> Fusarium sulphureum </i>, late blight on foliage, Silver scurf.  Tests found susceptibility to potato cyst nematode <i> Globodera pallida </i> Pa2/3,1 and resistance to <i> Globodera rostochiensis </i> Ro1.  ","Navan x 81C117-13",1,"Cygnet PB Ltd","Blairfield Farm",,Milnathort,Kinross-shire,"KY13 OSG","UNITED KINGDOM",cygnetpb@harleys.co.uk,www.cygnetpb.com,"+44 (0)1577 862 929","+44 (0)1577 863 741","Cygnet PB Ltd","Blairfield Farm",,Milnathort,Kinross-shire,"KY13 OSG","UNITED KINGDOM",cygnetpb@harleys.co.uk,www.cygnetpb.com,"+44 (0)1577 862 929","+44 (0)1577 863 741",2032,"Oval - long",White,Cream,Shallow,Smooth,Pink,Maincrop,Medium,White,Few,4,5,9,-,-,-,4,2,9,5,7,3,3,4,3,2,5,5,3,-,-,-,-
"Ivory Russet","Ivory Russet is a second early variety for the french fry market.  In trials it demonstrated resistance to dry rot (<i>F. coeruleum</i>), black dot, silver scurf, powdery scab and skin spot. The variety had susceptibility to dry rot (<i>F. sulphureum</i>), blackleg, tuber late blight, common scab, and bruising and splitting.","RZ 93-7105 x Innovator",1,"HZPC Holland B.V.","Box 88",NL-8500,"AB Joure",,,NETHERLANDS,,,,,"HZPC UK Limited","2 Wharf Road",Crowle,Scunthorpe,"North Lincolnshire","DN17 4HS","UNITED KINGDOM",info.uk@hzpc.com,www.hzpc.co.uk,"+44 (0)1724 71 00 33","+44 (0)1724 71 00 99",2046,Long,Russet,White,Shallow,-,Pink,"Second Early","Medium - tall","Red violet",-,3,1,-,-,-,-,-,4,6,6,3,3,9,7,9,9,8,3,5,-,-,-,-
Jaerla,..,"Sirtema x MPI 19268",1,-,-,-,-,-,-,-,-,-,-,-,"GB Seed Industry","These varieties are freely available and","sources can be found by clicking on the","national flags on each","variety description page.",,"UNITED KINGDOM",,,,,-,"Short - oval",Cream,"Light yellow","Shallow - medium",Medium,Pink,-,-,White,Absent,-,-,-,-,-,-,-,-,-,-,-,-,-,-,-,-,-,-,-,-,-,-,-
Jazzy,"Early maturity, high yielding firm cooking type with good taste and texture.  Testing was conducted in one year only for common scab and mop top (spraing), the rating based on this is a 6 for common scab and a 8 for mop top (spraing).","Franceline x Cupido",1,"Meijer Potato","Bathseweg 45",,Rilland,,"4411 RK ",NETHERLANDS,info@meijerpotato.com,https://www.meijerpotato.com/en/,"+31 (0)113 - 76 01 00",,"Meijer Potato UK","Bayfield Brecks Barns,","Garden Lane,","Letheringsett, Holt",Norfolk,"NR25 7DZ","UNITED KINGDOM",info@meijerpotato.co.uk,www.meijerpotato.co.uk,"01263 710602",,2041,Long,Cream,"Light yellow",Shallow,Smooth,-,"First Early",Medium,-,-,7,6,-,-,-,-,-,2,2,-,2,1,6,6,7,4,6,5,4,Medium,17%,-,Salad
Jelly,"Tubers have good  resistance to bruising and splitting.Â Â Trials have found good resistance to dry rot (<I>Fusarium coeruleum</I>) and potato mop top (spraing).Â Â This variety has low resistance to dry rot (<I>Fusarium sulphureum</I>) and late blight on tubers..Â Â Tests for resistance to potato cyst nematode demonstrated resistance to <i>Globodera rostochiensis</i> Ro1  and susceptibility to <i>Globodera pallida</i> Pa 2/3, 1.",-,1,-,-,-,-,-,-,-,-,-,-,-,"Greenvale AP",Springfield,Burrelton,Blairgowrie,Perthshire,"PH13 9PJ","UNITED KINGDOM",post@greenvale.co.uk,www.greenvale.co.uk,"+44 (0)1828 670343","+44 (0)1828 670636",-,Oval,Yellow,"Medium yellow","Very shallow",-,-,Maincrop,-,-,-,7,7,-,-,-,9,-,1,9,6,4,1,9,6,6,5,5,2,5,-,-,-,-
Jester,"Tubers have some  resistance to splitting and good  resistance to bruising.&nbsp;&nbsp;Trials have found good resistance to powdery scab, common scab and potato virus a..&nbsp;&nbsp;This variety has low resistance to dry rot and potato leafroll virus..&nbsp;&nbsp;Tests for resistance to potato cyst eelworm demonstrated susceptibility to both <i>Globodera rostochiensis</i> Ro1  and <i>Globodera pallida</i> Pa 2/3, 1.","Vales Emerald x 1288 AF 23",1,"Scottish Crop Research Institute",Invergowrie,,Dundee,,"DD2 5DA","UNITED KINGDOM",,www.scri.sari.ac.uk,"+44 (0)1382 562731",,"Greenvale AP",Springfield,Burrelton,Blairgowrie,Perthshire,"PH13 9PJ","UNITED KINGDOM",post@greenvale.co.uk,www.greenvale.co.uk,"+44 (0)1828 670343","+44 (0)1828 670636",-,"Short - oval",White,Cream,Shallow,-,Violet,"Second Early","Short - medium","Red violet",-,7,3,3,3,9,-,2,2,3,7,5,1,5,-,-,-,7,6,4,-,-,-,-
Joshua,"Joshua is a late maincrop variety.Â Â This variety  is particularily suitable for crisping.Â Â Tubers have some  resistance to bruising and splitting.Â Â Trials have found good resistance to dry rot (<i>F. coeruleum and F. sulphureum</i>).Â This variety has low resistance to late blight on tubers, powdery scab and potato leafroll virus.Â Â Tests for resistance to potato cyst nematode demonstrated susceptibility to both <i>Globodera rostochiensis</i> Ro1  and <i>Globodera pallida</i> Pa 2/3, 1.",-,1,-,-,-,-,-,-,-,-,-,-,-,-,-,-,-,-,-,-,-,-,-,-,-,Round,White,White,"Very deep",-,Blue,Maincrop,"Tall - very tall","Blue violet",Few,5,3,-,-,-,-,2,3,1,5,-,8,9,-,-,-,2,1,5,-,-,-,-
Jubilee,,"Kikko x 28 AG 05",1,-,-,-,-,-,-,-,-,-,-,-,-,-,-,-,-,-,-,-,-,-,-,-,"Short - oval",White,Cream,Shallow,-,Pink,Maincrop,Medium,White,-,5,7,4,4,9,-,5,-,-,5,5,8,4,-,-,-,5,5,4,-,-,-,-
Juliette,"Salad variety.","Nicola x Hansa",,"Germicopa SAS","1 Allee Loeiz Herrieu",,"29334 Quimper Cedex",Brittany,,FRANCE,,,,,"Germicopa UK","1 Wold View Road North",,Driffield,"East Yorkshire","YO25 6RP","UNITED KINGDOM",warren.keyes@germicopa.com,,"07867 442287",,2028,Long,Yellow,"Medium yellow","Very shallow - shallow",Smooth,-,-,-,White,-,4,-,-,-,-,-,-,1,9,7,-,-,-,-,-,-,6,6,6,Medium,19%,-,Salad
Karlena,"Karlena is an early variety producing a high yield of oval, cream-skinned tubers with a light yellow, floury flesh and medium depth of eyes.  Good for boiling and baking.","Adretta x III 69 121 55 N",1,"NORIKA GmbH","Parkweg 4",,"Groß Lüsewitz",,18190,GERMANY,info(at)norika.de,www.norika.de,"+ 49-38209 47 620",,-,-,-,-,-,-,-,-,-,-,-,-,"Short - oval",Cream,"Light yellow",Shallow,Medium,Pink,"Early Maincrop","Medium - tall","Red violet",-,-,-,-,-,-,-,-,-,-,-,-,-,-,-,-,-,-,-,-,-,-,-,-
Kelly,"Long term storage french fry variety suitable for organic production.","Crisba x INRA95T118.2",1,"Germicopa SAS","1 Allee Loeiz Herrieu",,"29334 Quimper Cedex",Brittany,,FRANCE,,,,,"Germicopa UK","1 Wold View Road North",,Driffield,"East Yorkshire","YO25 6RP","UNITED KINGDOM",warren.keyes@germicopa.com,,"07867 442287",,-,"Oval - long",White,-,Shallow,-,-,Maincrop,-,White,-,2,7,-,-,-,8,-,2,9,4,5,2,8,6,8,8,2,2,8,-,-,-,-
Kennebec,"Kennebec is an early maincrop variety bred in USA.  It produces a moderate to high yield of large, oval, white-skinned tubers with a cream flesh.Tests show susceptibility to both potato cyst nematode <i> Globodera pallida </i> Pa2/3,1 and <i> Globodera rostochiensis </i> Ro1. ","B127 x USDA X96 56",1,"United States Department of Agriculture","1400 Independence Ave., S.W.",,Washington,,"DC 20250","UNITED STATES",,www.usda.gov,,,"GB Seed Industry","These varieties are freely available and","sources can be found by clicking on the","national flags on each","variety description page.",,"UNITED KINGDOM",,,,,-,Oval,Cream,Cream,Shallow,Smooth,Pink,"Early Maincrop",Medium,White,Absent,-,-,-,-,-,-,-,2,2,-,-,-,-,-,-,-,-,-,-,-,-,-,-
"Kerr's Pink","Suitable for pre-pack and general ware. Short oval, pink tubers with cream flesh. Late foliage maturity. Moderate yields. Medium dry matter.  Tests show susceptibility to skin spot and both potato cyst nematode <i> Globodera rostochiensis </i> Ro1 and <i> Globodera pallida </i> Pa2/3,1.","Fortyfold x Smiths Early",1,-,-,-,-,-,-,-,-,-,-,-,"GB Seed Industry","These varieties are freely available and","sources can be found by clicking on the","national flags on each","variety description page.",,"UNITED KINGDOM",,,,,-,"Short - oval",Red,Cream,Medium,Smooth,Pink,Maincrop,"Very tall",White,Absent,-,-,6,-,-,-,5,2,2,4,-,-,5,2,-,-,-,4,4,-,-,-,-
Kestrel,"Kestrel gives good yields of very attractive, long oval, parti-coloured tubers which have good all round cooking quality. It has good chipping potential, particularly early in the season.","Solanum vernei x Cara",1,"Caithness Potato Breeders Ltd","Brigade House","Brigade Street",Blackheath,London,"SE3 0TW","UNITED KINGDOM",exportenquiries@caithnesspotatoes.com,www.caithnesspotatoes.com,"+44 (0)20 8297 1020","+44 (0)20 8297 2125","Caithness Potatoes Ltd","26 York Place",,Perth,,"PH2 8EH","UNITED KINGDOM",enquiries@caithnesspotatoes.com,www.caithnesspotatoes.com,"+44 (0)1738 446723","+44 (0)1738 628124",2022,"Oval - long","Blue parti-coloured",Cream,"Shallow - medium",Smooth,Blue,"Second Early",Medium,"Blue violet",Absent,7,4,7,-,-,-,3,4,-,4,8,-,-,-,-,-,5,3,5,-,-,-,-
Kifli,"Tubers have good  resistance to bruising and splitting.Â Â Trials have found good resistance to silver scurf, blackleg, potato virus Yo, and black dot .This variety has low resistance to potato leafroll virus and dry rot (<i>Fusarium sulphureum</i>).Â Â Tests for resistance to potato cyst nematode demonstrated resistance to  <i>Globodera rostochiensis</i> Ro1  and susceptibility to <i>Globodera pallida</i> Pa 2/3, 1. ","Kifli-267 x 84.13.6 ",1,"SÃ¡rvÃ¡ri Research Trust","Siambra Gwynion Llandygai",,Bangor,,"LL57 4BG","UNITED KINGDOM",info@sarvari-trust.org,www.sarvari-trust.org,"+44 (0)1248 364260","+44 (0)1248 681730",-,-,-,-,-,-,-,-,-,-,-,2039,Long,White,Cream,Medium,-,Pink,Maincrop,"Medium - tall",White,-,7,6,7,-,-,-,3,2,9,4,7,2,5,4,7,8,3,5,5,-,-,-,-
Kikko,"Very high yielding drought resistant variety.  Tubers are long to long-oval and have good skin finish.  Susceptibility to Blackleg.  It is resistant to potato cyst nematode <i> Globodera rostochiensis </i>  Ro1.  Suitable for boiling and steaming.","Slaney x C1992/42",1,"Teagasc Crops Research Centre","Oak Park Research Centre",,Carlow,,,IRELAND,,www.teagasc.ie,"+353 59 9170200","+353 59 9142423","Irish Potato Marketing Ltd","East Den Brae",,Letham,Angus,"DD8 2PJ","UNITED KINGDOM",info@ipmscotland.co.uk,www.ipm.ie,"+44 (0)1307 818121","+44 (0)1307 818131",-,"Oval - long",White,"Light yellow",Shallow,Smooth,Pink,Maincrop,"Medium - tall",White,Medium,-,-,-,-,-,-,-,-,9,6,2,-,-,-,-,-,5,6,5,-,-,-,-
"King Edward","Late maincrop maturity producing moderate yields with high numbers of tubers per plant.  Good resistance to common scab, powdery scab, spraing, mild mosaic virus and slugs.  Moderately susceptible to drought, foliage blight, potato virus Yo, and susceptible to potato cyst nematode <i> Globodera rostochiensis </i> Ro1 and <i> Globodera pallida </i>.  Medium dry matter with good cooking quality, flavour and frying colour.","Magnum Bonam x Beauty of Hebron",1,-,-,-,-,-,-,-,-,-,-,-,"GB Seed Industry","These varieties are freely available and","sources can be found by clicking on the","national flags on each","variety description page.",,"UNITED KINGDOM",,,,,-,"Oval - long","Red parti-coloured",Cream,"Shallow - medium",Smooth,Pink,Maincrop,Tall,"Red violet",Absent,6,5,2,-,-,-,5,2,2,7,4,-,-,3,3,6,7,4,3,-,-,-,-
Kingsman,,"Excalibur x Caesar",1,"Cygnet PB Ltd","Blairfield Farm",,Milnathort,Kinross-shire,"KY13 OSG","UNITED KINGDOM",cygnetpb@harleys.co.uk,www.cygnetpb.com,"+44 (0)1577 862 929","+44 (0)1577 863 741","Cygnet PB Ltd","Blairfield Farm",,Milnathort,Kinross-shire,"KY13 OSG","UNITED KINGDOM",cygnetpb@harleys.co.uk,www.cygnetpb.com,"+44 (0)1577 862 929","+44 (0)1577 863 741",-,"Short - oval",White,"Medium yellow","Very shallow - shallow",-,Pink,"Early Maincrop",Medium,White,-,6,9,-,-,-,-,-,2,9,3,8,1,8,-,-,-,4,5,4,-,-,-,-
Kondor,"Red skinned maincrop table potato, which is high yielding, high bulking and copes well with heat and drought stress. Mainly an export variety from the UK. Tests show susceptibility to silver scurf, Blackleg, potatos cyst nematode <i> Globodera rostochiensis </i> Ro1 and <i> Globodera pallida </i> Pa2/3,1 and Splitting.  ","KO61-333 x Wilja",1,"Konst Research BV","Speringweg 970",,Zwaanshoek,,NL2136,NETHERLANDS,,,,,"Agrico UK Ltd","Castleton of Eassie",,"By Forfar",Angus,"DD8 1SJ","UNITED KINGDOM",potatoes@agrico.co.uk,www.agrico.co.uk,"+44 (0)1307 840551","+44 (0)1307 840245",2014,"Oval - long",Red,"Light yellow","Shallow - medium",Medium,Pink,"Early Maincrop",Medium,"Red violet",Few,5,2,4,-,-,-,6,2,2,6,3,-,-,-,3,-,5,6,4,-,-,-,-
"La Strada","Tubers have some resistance to splitting and bruising.Â Â Trials have found good resistance to dry rot (<i>F. sulphureum</i>), powdery scab, common scab and potato virus A.Â This variety has low resistance to potato leafroll virus and Potato virus Yn.Â Â Tests for resistance to potato cyst nematode demonstrated susceptibility to both <i>Globodera rostochiensis</i> Ro1  and <i>Globodera pallida</i> Pa 2/3, 1.","Cosmos x Osprey",1,"Cygnet PB Ltd","Blairfield Farm",,Milnathort,Kinross-shire,"KY13 OSG","UNITED KINGDOM",cygnetpb@harleys.co.uk,www.cygnetpb.com,"+44 (0)1577 862 929","+44 (0)1577 863 741","Cygnet PB Ltd","Blairfield Farm",,Milnathort,Kinross-shire,"KY13 OSG","UNITED KINGDOM",cygnetpb@harleys.co.uk,www.cygnetpb.com,"+44 (0)1577 862 929","+44 (0)1577 863 741",2043,Oval,White,White,"Very shallow",-,Absent,"Early Maincrop","Short - medium",White,-,5,6,5,3,8,-,2,2,2,7,5,7,5,8,6,5,7,3,4,-,-,-,-
"Lady Amarilla","Multipurpose variety for crisping and processing, with all year round quality.","Agria x Hermes",,"Meijer Potato","Bathseweg 45",,Rilland,,"4411 RK ",NETHERLANDS,info@meijerpotato.com,https://www.meijerpotato.com/en/,"+31 (0)113 - 76 01 00",,"Meijer Potato UK","Bayfield Brecks Barns,","Garden Lane,","Letheringsett, Holt",Norfolk,"NR25 7DZ","UNITED KINGDOM",info@meijerpotato.co.uk,www.meijerpotato.co.uk,"01263 710602",,-,"Oval - long",Yellow,"Medium yellow",Shallow,Smooth,-,"Early Maincrop",Medium,White,-,9,-,6,8,8,-,7,-,-,6,-,-,-,-,-,-,-,-,-,Long,22%,-,Fluffy
"Lady Anna","Good shape and uniformity that suits the French fry sector with high yields. Testing was conducted in one year only for common scab and mop top (spraing), the rating based on this is a 7 for common scab and a 8 for mop top (spraing).","CMK1993-042-005 x Fontane",1,"Meijer Potato","Bathseweg 45",,Rilland,,"4411 RK ",NETHERLANDS,info@meijerpotato.com,https://www.meijerpotato.com/en/,"+31 (0)113 - 76 01 00",,"Meijer Potato UK","Bayfield Brecks Barns,","Garden Lane,","Letheringsett, Holt",Norfolk,"NR25 7DZ","UNITED KINGDOM",info@meijerpotato.co.uk,www.meijerpotato.co.uk,"01263 710602",,2041,"Oval - long",Cream,"Medium yellow",Shallow,Smooth,-,Maincrop,Medium,White,-,6,5,-,-,-,-,-,2,9,-,4,1,4,9,7,5,5,3,3,Long,23%,-,-
"Lady Balfour","Lady Balfour is a very high yielding organic variety. Vigour is exceptional under low fertility conditions.  Dormancy is extremely long, allowing long term storage without the use of sprout suppressants. Susceptible to late Blackdot, dry rot <i> Fusarium sulphureum </i>, silver scurf, skin spot and potato leafroll virus.  resistance to late blight on tubers, powdery scab, blackleg and potato virus Yo.  ","8204 A4 x 15119 AC5",1,"Scottish Crop Research Institute",Invergowrie,,Dundee,,"DD2 5DA","UNITED KINGDOM",,www.scri.sari.ac.uk,"+44 (0)1382 562731",,"Greenvale AP",Springfield,Burrelton,Blairgowrie,Perthshire,"PH13 9PJ","UNITED KINGDOM",post@greenvale.co.uk,www.greenvale.co.uk,"+44 (0)1828 670343","+44 (0)1828 670636",2032,Oval,"Red parti-coloured",White,Medium,Medium,Pink,Maincrop,"Very tall",-,Absent,5,6,9,-,-,-,3,4,4,4,7,3,6,3,3,3,8,7,4,-,-,-,-
"Lady Christl","Lady Christl is a high yielding variety of numerous uniform attractive tubers.  Excellent cooking qualities. Lady Christl shows good resistance to bruising, splitting, common scab and potato leafroll virus. It is susceptible to foliage blight and very susceptible to silver scurf and black dot.  Tests for resistance to potato cyst nematode demonstrated resistance to  <i>Globodera rostochiensis</i> Ro1  and susceptibility to <i>Globodera pallida</i> Pa 2/3, 1. Susceptible to Sencorex damage.
","WS733-391 x Mansour",1,"Meijer Potato","Bathseweg 45",,Rilland,,"4411 RK ",NETHERLANDS,info@meijerpotato.com,https://www.meijerpotato.com/en/,"+31 (0)113 - 76 01 00",,"Meijer Potato UK","Bayfield Brecks Barns,","Garden Lane,","Letheringsett, Holt",Norfolk,"NR25 7DZ","UNITED KINGDOM",info@meijerpotato.co.uk,www.meijerpotato.co.uk,"01263 710602",,2026,"Oval - long",Cream,"Light yellow",Shallow,Smooth,Pink,"First Early",Medium,"Red violet",Absent,8,7,9,-,-,-,3,2,9,7,5,5,3,2,2,2,3,5,2,-,-,-,-
"Lady Claire","Lady Claire is a specialist crisping variety, with medium dry matters and very low, stable reducing sugars, ideally suited to long tem storage for late crisp production.  It will produce moderate to high yields of round uniform tubers with low outgrades, but requires careful management to achieve its full potential. Susceptible to Blackdot, late blight on foliage and common scab.  Resistance to Skin spot, potato leafroll virus and potato virus Yo.  Tests for resistance to potato cyst nematode demonstrated resistance to  <i>Globodera rostochiensis</i> Ro1  and some resistance to <i>Globodera pallida</i> Pa 2/3, 1.","Agria x KW 78-34-470",1,"Meijer Potato","Bathseweg 45",,Rilland,,"4411 RK ",NETHERLANDS,info@meijerpotato.com,https://www.meijerpotato.com/en/,"+31 (0)113 - 76 01 00",,"Meijer Potato UK","Bayfield Brecks Barns,","Garden Lane,","Letheringsett, Holt",Norfolk,"NR25 7DZ","UNITED KINGDOM",info@meijerpotato.co.uk,www.meijerpotato.co.uk,"01263 710602",,2026,Oval,Cream,"Light yellow","Shallow - medium",Smooth,Blue,Maincrop,Medium,White,Absent,6,6,7,-,-,-,7,4,9,3,4,5,5,8,4,3,4,4,3,-,-,-,-
"Lady Jo","Lady Jo is a specialist crisping variety, with high dry matters and low reducing sugars, ideally suited for mid term production of quality crisps.  It has early to medium crop maturity, and will produce moderate to high yields of round uniform tubers with low outgrades. Susceptible to Blackleg, Shows resistance to Dry Rot <i> Fusarium coeruleum </i>.  Tests for resistance to potato cyst nematode demonstrated resistance to  <i>Globodera rostochiensis</i> Ro1  and susceptibility to <i>Globodera pallida</i> Pa 2/3, 1.","CMK1987.203.014 x VE74-45",1,"Meijer Potato","Bathseweg 45",,Rilland,,"4411 RK ",NETHERLANDS,info@meijerpotato.com,https://www.meijerpotato.com/en/,"+31 (0)113 - 76 01 00",,"Meijer Potato UK","Bayfield Brecks Barns,","Garden Lane,","Letheringsett, Holt",Norfolk,"NR25 7DZ","UNITED KINGDOM",info@meijerpotato.co.uk,www.meijerpotato.co.uk,"01263 710602",,2031,-,-,-,-,-,Blue,Maincrop,"Medium - tall",White,Absent,7,7,-,-,-,-,-,3,9,5,2,4,8,7,8,6,7,4,4,-,-,-,-
"Lady Olympia","Lady Olympia, produces high numbers of long oval tubers with white skins with light yellow flesh.  It has low levels of outgrades with good all-round disease resistance and good resistance to bruising and damage.  Lady Olympia also possesses good long term storage potential, well suited to the processing sector.","Agria x KW78-34-470",1,"Meijer Potato","Bathseweg 45",,Rilland,,"4411 RK ",NETHERLANDS,info@meijerpotato.com,https://www.meijerpotato.com/en/,"+31 (0)113 - 76 01 00",,"Meijer Potato UK","Bayfield Brecks Barns,","Garden Lane,","Letheringsett, Holt",Norfolk,"NR25 7DZ","UNITED KINGDOM",info@meijerpotato.co.uk,www.meijerpotato.co.uk,"01263 710602",,2026,"Oval - long",Cream,"Medium yellow",Shallow,Medium,Blue,Maincrop,"Short - medium",White,Absent,-,-,-,-,-,-,-,-,-,-,-,-,-,-,-,-,-,-,-,-,-,-,-
"Lady Rosetta","Lady Rosetta is a specialist crisping variety, with high dry matters and low reducing sugars.  It has early crop maturity and is suitable to quality crisp production either fresh or from short term storage.  Moderate to high yields of uniform, round tubers with low outgrades, with good all-round disease resistance. Susceptible to Powdery scab, Bolackleg and potato cyst nematode <i> Globodera pallida </i> Pa2/3,1.  shows resistance to Splitting and resistant to potato cyst nematode <i> Globodera rostochiensis </i> Ro1.","Cardinal x SVP(VTN2)62.33.3",1,"Meijer Potato","Bathseweg 45",,Rilland,,"4411 RK ",NETHERLANDS,info@meijerpotato.com,https://www.meijerpotato.com/en/,"+31 (0)113 - 76 01 00",,"Meijer Potato UK","Bayfield Brecks Barns,","Garden Lane,","Letheringsett, Holt",Norfolk,"NR25 7DZ","UNITED KINGDOM",info@meijerpotato.co.uk,www.meijerpotato.co.uk,"01263 710602",,2019,Round,Red,"Light yellow","Shallow - medium",Medium,Pink,"Early Maincrop",Medium,"Red violet",Absent,6,7,5,-,-,-,6,2,9,6,3,-,-,-,-,-,3,4,4,-,-,-,-
"Lady Valora","Strong stable long term storage variety for the crisping market. Suitable for un-irrigated production, low reducing sugars giving a consistent factory product. Results for PVYO, PVYN and PVA are not from independent testing and were supplied by the agent.","Lady Claire x Charisma",1,"Meijer Potato","Bathseweg 45",,Rilland,,"4411 RK ",NETHERLANDS,info@meijerpotato.com,https://www.meijerpotato.com/en/,"+31 (0)113 - 76 01 00",,"Meijer Potato UK","Bayfield Brecks Barns,","Garden Lane,","Letheringsett, Holt",Norfolk,"NR25 7DZ","UNITED KINGDOM",info@meijerpotato.co.uk,www.meijerpotato.co.uk,"01263 710602",,2038,Oval,White,"Light yellow","Shallow - medium",-,-,Maincrop,Medium,White,-,6,7,5,8,8,7,-,2,8,6,3,9,6,8,7,5,5,4,4,Long,23%,-,-
Lanorma,"Tubers have some  resistance to splitting and good  resistance to bruising.Â Â Trials have found good resistance to common scab, skin spot, dry rot <i> Fusarium coeruleum </i> and silver scurf.Â Â This variety has low resistance to dry rot <i> Fusarium sulphureum </i> and late blight on tubers.Â Â Tests for resistance to potato cyst nematodes demonstrated resistance to  <i>Globodera rostochiensis</i> Ro1  and partial resistance to  <i>Globodera pallida</i> Pa 2/3, 1.","Bydand x Caesar",1,-,-,-,-,-,-,-,-,-,-,-,"Branston Ltd","Mere Road",Branston,Lincoln,Lincolnshire,"LN4 1NJ","UNITED KINGDOM",,,,,2036,"Short - oval",White,"Light yellow",-,-,-,"Early Maincrop","Medium - tall",White,Few,6,4,-,-,-,-,-,5,9,7,4,1,9,8,9,6,4,2,4,-,-,-,-
Leonata,"Leonata is for the French fry market, the variety gives stable yields, under stress conditions and on all soil types. Has a high dry matter content, long oval tubers and is suitable for long term storage
","VR00-847 x RZD 95-1618",,"Stet Holland","Produktieweg 2a",,Emmeloord,,"8304 AV",NETHERLANDS,,,,,"Stet Potato Ltd","12 Vincent Court","Turnstone Road, Teal Park",Lincoln,,"LN6 3AE","UNITED KINGDOM",peter.hewett@stet-potato.com,http://www.stet-potato.com/en/,07788311967,,-,Long,Cream,Cream,Shallow,Medium,-,Maincrop,Medium,-,Few,8,8,7,-,-,-,-,1,9,6,-,-,-,-,-,-,-,5,5,"Very Long",22%,-,-
Libertie,,"Harmony x Divaa",1,"Caithness Potato Breeders Ltd","Brigade House","Brigade Street",Blackheath,London,"SE3 0TW","UNITED KINGDOM",exportenquiries@caithnesspotatoes.com,www.caithnesspotatoes.com,"+44 (0)20 8297 1020","+44 (0)20 8297 2125",-,-,-,-,-,-,-,-,-,-,-,2046,-,White,White,Shallow,-,Pink,"Early Maincrop",-,"Red violet",-,7,7,-,1,9,-,4,-,-,6,5,1,7,-,-,-,7,4,5,-,-,-,-
