Primura,"The variety is suited to early ware production and is used mainly in Italy currently. The variety is popular in the Bologne region and as such has a protected regional status, â€œPatata de Bologne PDOâ€.
","Sirtema x Majestic",1,-,-,-,-,-,-,-,-,-,-,-,-,-,-,-,-,-,-,-,-,-,-,-,Oval,Cream,"Light yellow",Shallow,Smooth,Pink,-,-,White,Absent,-,-,-,-,-,-,-,-,-,-,-,-,-,-,-,-,-,-,-,-,-,-,-
"Purple Majesty","Purple Majesty is an early maincrop  variety.Â Â This variety is particularily suitable for salads / punnets.Â Â This variety has low resistance to dry rot <i> Fusarium sulphureum </i>, potato virus Yn, late blight on foliage and late blight on tubers.  The variety has resistance to potato virus A.  Tests for resistance to potato cyst nematode demonstrated susceptibility to both <i>Globodera rostochiensis</i> Ro1  and <i>Globodera pallida</i> Pa 2/3, 1.","All Blue x ND2008-2",1,-,-,-,-,-,-,-,-,-,-,-,"Albert Bartlett and Sons (Airdrie) Ltd","New Monkland","251 Stirling Road",Airdrie,Lanarkshire,"ML6 7SP","UNITED KINGDOM",,,,,-,Oval,Blue,-,Shallow,-,Blue,"Early Maincrop",Medium,"Blue violet",Few,5,5,5,3,6,-,4,2,3,6,5,1,6,-,-,-,4,2,3,-,-,-,-
Radebe,,"Golden Millenium x Erasmus",1,"Higgins Agriculture Ltd","Greenbank House",Finningley,Doncaster,,"DN9 3BZ","UNITED KINGDOM",potatoes@higgins.co.uk,www.higgins.eu.com,"+44 (0)1302 770591","+44 (0)1302 770668","Cygnet PB Ltd","Blairfield Farm",,Milnathort,Kinross-shire,"KY13 OSG","UNITED KINGDOM",cygnetpb@harleys.co.uk,www.cygnetpb.com,"+44 (0)1577 862 929","+44 (0)1577 863 741",-,"Short - oval",White,Cream,Shallow,-,Pink,Maincrop,Tall,White,-,7,8,-,-,-,-,-,2,6,4,8,5,7,-,-,-,7,2,5,-,-,-,-
Raleigh,,"Lulu x Upmarket",1,"Dr J Dunnett, Caithness Varieties Ltd",Clevnagreen,,Freswick,Caithness,"KW1 4XX","UNITED KINGDOM",,,,,-,-,-,-,-,-,-,-,-,-,-,-,Oval,White,Cream,Shallow,-,Pink,"Second Early",-,-,-,3,2,-,-,-,3,-,2,8,7,3,1,7,3,7,8,7,3,4,-,-,-,-
Ramos,"Tubers have some  resistance to bruising and splitting.Â Â Trials have found good resistance to silver scurf and dry rot (<i>F. coeruleum</i>).Â Â This variety has low resistance to late blight on tubers.Â Â Tests for resistance to potato cyst nematode demonstrated resistance to  <i>Globodera rostochiensis</i> Ro1  and partial resistance to  <i>Globodera pallida</i> Pa 2/3, 1.","Agria x VK 69-491",1,"Handelmij Van Rijn BV","Postbus 98",,Poeldijk,,"2685 DG",NETHERLANDS,,,"+31 (0) 174  41 94 00","+31 (0) 174  42 01 39",-,-,-,-,-,-,-,-,-,-,-,2031,"Oval - long",Yellow,"Light yellow",Shallow,Smooth,-,"Early Maincrop","Medium - tall",White,Medium,4,5,-,-,-,-,-,4,8,5,4,4,8,4,7,5,5,2,4,-,-,-,-
"Ranger Russet","Ranger Russet was bred in Idaho, USA for the french fry market.Â Â Trials have found good resistance to blackleg.Â Â This variety has low resistance to powdery scab, late blight on tubers and foliage.Â Â Tests for resistance to potato cyst nematode demonstrated susceptibility to both <i>Globodera rostochiensis</i> Ro1  and <i>Globodera pallida</i> Pa 2/3, 1.","Butte x A6595 3",1,"United States Department of Agriculture","1400 Independence Ave., S.W.",,Washington,,"DC 20250","UNITED STATES",,www.usda.gov,,,"GB Seed Industry","These varieties are freely available and","sources can be found by clicking on the","national flags on each","variety description page.",,"UNITED KINGDOM",,,,,-,"Oval - long",Cream,Cream,Shallow,Rough,Pink,-,-,"Red violet",Absent,6,6,4,-,-,-,5,3,2,5,7,-,-,-,-,-,1,2,3,-,-,-,-
Record,"Maincrop. Suitable for processing â€“ crisps. Oval yellow-skinned tubers with light yellow flesh. Moderate yields with low outgrade levels, mainly misshapen tubers and growth cracks. Susceptible to blackleg, virus Yo, potato cyst nematode <i> Globodera rostochiensis </i> Ro1 and <i> Globodera pallida </i> Pa2/3,1. . Good resistance to powdery scab, splitting and spraing (TRV). High dry matter.",-,1,-,-,-,-,-,-,-,-,-,-,-,"GB Seed Industry","These varieties are freely available and","sources can be found by clicking on the","national flags on each","variety description page.",,"UNITED KINGDOM",,,,,-,Oval,Cream,"Light yellow",Medium,Rough,Blue,Maincrop,Medium,White,-,6,7,2,-,-,-,4,2,2,6,2,-,-,-,-,-,7,6,5,-,-,-,-
"Red Cara","Red Cara produces a very fast emerging canopy and vigorous plants.  Tubers are uniform and suitable for a range of culinary uses including home chipping.  It is high yielding and keeps well in storage. Susceptible to powdery scab.  Shows resistance to late blight on foliage and tubers.  Resistant to potato cyst nematode <i> Globodera rostochiensis</i> Ro1.","Ulster Glade x A25/19",1,"Teagasc Crops Research Centre","Oak Park Research Centre",,Carlow,,,IRELAND,,www.teagasc.ie,"+353 59 9170200","+353 59 9142423","Irish Potato Marketing Ltd","East Den Brae",,Letham,Angus,"DD8 2PJ","UNITED KINGDOM",info@ipmscotland.co.uk,www.ipm.ie,"+44 (0)1307 818121","+44 (0)1307 818131",-,Oval,Red,Cream,Shallow,Medium,Pink,Maincrop,"Very tall",White,Many,-,-,-,-,-,-,-,-,9,6,6,-,-,-,-,-,3,7,7,-,-,-,-
"Red Duke Of York",".Â Â This variety has low resistance to late blight on foliage, late blight on tubers, common scab, potato leafroll virus and potato virus Yo ..","Variant of Duke of York",1,-,-,-,-,-,-,-,-,-,-,-,"GB Seed Industry","These varieties are freely available and","sources can be found by clicking on the","national flags on each","variety description page.",,"UNITED KINGDOM",,,,,-,Oval,Red,"Light yellow","Very shallow - shallow",Medium,Pink,"First Early",Short,"Red violet",Absent,-,-,2,-,-,-,2,-,-,2,-,-,5,5,-,-,-,2,2,-,-,-,-
"Red Emmalie","Red Emmalie is an early maincrop variety with red skin and red flesh.  Tubers have some  resistance to bruising and splitting.Â Â Trials have found good resistance to common scab, dry rots (<i>F. coeruleum and F. sulphureum</i>), blackleg and potato leafroll virus..Â Â This variety has low resistance to late blight on foliage.Â Â Tests for resistance to potato cyst nematode demonstrated susceptibility to both <i>Globodera rostochiensis</i> Ro1  and <i>Globodera pallida</i> Pa 2/3, 1.",,1,"Karsten Ellenberg","Ebstorfer Str 1",,Barum,,29576,GERMANY,,,,,-,-,-,-,-,-,-,-,-,-,-,-,Long,Red,-,Shallow,-,Pink,"Early Maincrop","Medium - tall","Red violet",Many,4,4,-,2,9,9,8,3,2,7,8,8,8,9,5,7,4,3,4,-,-,-,-
"Red Pontiac","An American bred, early maincrop variety producing round - oval, red-skinned tubers with a creamy, waxy flesh.  Red Pontiac is a good baking variety.","Bliss Triumph x Katahdin",1,-,-,-,-,-,-,-,-,-,-,-,"GB Seed Industry","These varieties are freely available and","sources can be found by clicking on the","national flags on each","variety description page.",,"UNITED KINGDOM",,,,,-,"Short - oval",Red,Cream,Medium,Smooth,Pink,"Second Early",Medium,"Red violet",Absent,-,-,-,-,-,-,-,-,-,-,-,-,-,-,-,-,-,-,-,-,-,-,-
Redrobin,"Tubers have good  resistance to bruising and splitting. Susceptible to blackleg and potato virus Yo.Â Â Trials have found strong resistance to dry rot (<i>Fusarium coeruleum</i>). Â Tests for resistance to potato cyst nematode demonstrated resistance to  <i>Globodera rostochiensis</i> Ro1  and susceptibility to <i>Globodera pallida</i> Pa 2/3, 1.","Red One x Miriam",1,"Gerrol Jalving","Meeson Hall Farm",,Meeson,Shropshire,"TF6 6PG","UNITED KINGDOM",,,,,"Agrico UK Ltd","Castleton of Eassie",,"By Forfar",Angus,"DD8 1SJ","UNITED KINGDOM",potatoes@agrico.co.uk,www.agrico.co.uk,"+44 (0)1307 840551","+44 (0)1307 840245",2040,Oval,Red,"Medium yellow","Very shallow - shallow",-,Pink,"Second Early","Short - medium","Red violet",-,7,7,3,-,-,-,6,2,9,5,3,4,8,8,6,5,6,3,4,-,-,-,-
Reiver,,"Gladiator x Valor",1,-,-,-,-,-,-,-,-,-,-,-,-,-,-,-,-,-,-,-,-,-,-,-,"Short - oval",White,"Light yellow",Shallow,-,Pink,"Early Maincrop",-,-,-,5,5,-,-,-,9,-,3,9,4,6,2,8,8,5,6,7,4,5,-,-,-,-
Remarka,..,"Edzina x SVP AM 66 42",1,-,-,-,-,-,-,-,-,-,-,-,"HZPC UK Limited","2 Wharf Road",Crowle,Scunthorpe,"North Lincolnshire","DN17 4HS","UNITED KINGDOM",info.uk@hzpc.com,www.hzpc.co.uk,"+44 (0)1724 71 00 33","+44 (0)1724 71 00 99",-,Oval,Cream,"Light yellow",Shallow,Smooth,Pink,Maincrop,Medium,White,Few,-,-,-,-,-,-,-,-,-,-,-,-,-,-,-,-,-,-,4,-,-,-,-
Rembrandt,"Rembrandt  produces good yields of bold oval tubers, with moderate to high dry matters well suited to early French fry production and general processing.  Rembrandt has the potential for good skin finish and can be suitable for table consumption.  Rembrandt is susceptible to potato leafroll virus.  Shows resistance to late blight on tubers, powdery scab, potato virus Yo, bruising and splitting.  When tested for resistance to potato cyst nematode showed susceptibility to <i> Globodera pallida </i> Pa2/3,1 and resistant to <i> Globodera rostochiensis </i> Ro1.  ","Agria x Balder",1,"HZPC UK Limited","2 Wharf Road",Crowle,Scunthorpe,"North Lincolnshire","DN17 4HS","UNITED KINGDOM",info.uk@hzpc.com,www.hzpc.co.uk,"+44 (0)1724 71 00 33","+44 (0)1724 71 00 99","HZPC UK Limited","2 Wharf Road",Crowle,Scunthorpe,"North Lincolnshire","DN17 4HS","UNITED KINGDOM",info.uk@hzpc.com,www.hzpc.co.uk,"+44 (0)1724 71 00 33","+44 (0)1724 71 00 99",2030,"Oval - long",Yellow,"Medium yellow","Shallow - medium",Medium,Violet,Maincrop,"Medium - tall",White,Few,8,8,8,-,-,-,3,3,9,6,4,6,6,6,-,5,7,7,5,-,-,-,-
Revie,,"Amour x Romano",1,"Higgins Agriculture Ltd","Greenbank House",Finningley,Doncaster,,"DN9 3BZ","UNITED KINGDOM",potatoes@higgins.co.uk,www.higgins.eu.com,"+44 (0)1302 770591","+44 (0)1302 770668",-,-,-,-,-,-,-,-,-,-,-,-,"Short - oval","Red parti-coloured",White,Shallow,-,-,"Early Maincrop",Short,-,-,7,8,4,2,8,9,4,2,8,5,5,1,7,6,8,5,6,6,5,-,-,-,-
Richhill,"Tubers have good resistance to splitting and some resistance to bruising.Â Â Trials have found good resistance to blackleg and skin spot. Â Tests for resistance to potato cyst nematode demonstrated resistance to  <i>Globodera rostochiensis</i> Ro1  and susceptibility to <i>Globodera pallida</i> Pa 2/3, 1.","Cosmos x Valor",1,"P Watts",AFBI,,Loughgall,Armagh,"BT61 8JB","UNITED KINGDOM",,,,,-,-,-,-,-,-,-,-,-,-,-,2038,"Short - oval",White,"Light yellow","Very shallow - shallow",-,Pink,Maincrop,"Medium - tall","Red violet",-,5,7,3,-,-,-,4,2,9,5,7,4,6,7,5,4,5,6,5,-,-,-,-
Robinta,"Tubers have excellent resistance to splitting and good resistance to bruising.Â Â Trials have found good resistance to late blight on tubers, powdery scab, skin spot and potato leafroll virus.Â This variety has low resistance to potato virus Yo.Â Â Tests for resistance to potato cyst nematode demonstrated resistance to  <i>Globodera rostochiensis</i> Ro1  and susceptibility to <i>Globodera pallida</i> Pa 2/3, 1.","Rubinia x SVP Ve 70-9",1,"HZPC UK Limited","2 Wharf Road",Crowle,Scunthorpe,"North Lincolnshire","DN17 4HS","UNITED KINGDOM",info.uk@hzpc.com,www.hzpc.co.uk,"+44 (0)1724 71 00 33","+44 (0)1724 71 00 99",-,-,-,-,-,-,-,-,-,-,-,2022,Oval,Red,Cream,Shallow,Smooth,Pink,"Early Maincrop",Medium,"Red violet",Few,7,8,2,-,-,-,7,3,9,5,6,4,5,7,-,5,7,7,4,-,-,-,-
Rock,"Suitable for table and french fry variety. High yielder with shallow eyed oval tubers. Testing was conducted in one year only for common scab and mop top (spraing), the rating based on this is a 5 for common scab and a 4 for mop top (spraing).","Ramos x CMK1993-042-005",1,"Meijer Potato","Bathseweg 45",,Rilland,,"4411 RK ",NETHERLANDS,info@meijerpotato.com,https://www.meijerpotato.com/en/,"+31 (0)113 - 76 01 00",,"Meijer Potato UK","Bayfield Brecks Barns,","Garden Lane,","Letheringsett, Holt",Norfolk,"NR25 7DZ","UNITED KINGDOM",info@meijerpotato.co.uk,www.meijerpotato.co.uk,"01263 710602",,2043,Oval,Yellow,"Light yellow",Shallow,Smooth,-,Maincrop,Medium,White,-,5,5,-,-,-,-,-,3,9,-,1,8,5,4,6,5,6,4,4,Medium,21%,-,-
Rocket,"Produces extremely early yield of firm, waxy texture tubers.  Particularly suited to green top lifting and responds well under polythene.  Yields best under long day length conditions of Northern Europe.  Susceptible to late blight on tubers and powdery scab. Resistnace to Bruising and splitting Resistant to potato cyst nematode <i> Globodera rostochiensis </i> Ro1. ","F12/17 x D42/8",1,"Plant Breeding Institute",Unknown,,Norwich,,,"UNITED KINGDOM",,,,,"Cygnet PB Ltd","Blairfield Farm",,Milnathort,Kinross-shire,"KY13 OSG","UNITED KINGDOM",cygnetpb@harleys.co.uk,www.cygnetpb.com,"+44 (0)1577 862 929","+44 (0)1577 863 741",2017,Round,White,White,Shallow,Smooth,Blue,"First Early","Short - medium","Blue violet",Few,7,7,4,-,-,-,5,5,9,5,6,-,-,-,-,-,3,1,4,-,-,-,-
Romano,"Suitable for pre-pack and general ware. Short oval, red tubers with cream flesh. Long dormancy. High yields with low out grade levels. Susceptible to leaf roll virus. Good resistance to skin spot, bruisng, dry rot <i>(Fusarium sulphureum)</i>, virus Yo, and spraing. Good resistance to skin spot. Susceptible to potato cyst nematode <i> Globodera pallida </i> Pa2/3,1 and <i> Globodera rostochiensis </i> Ro1. ","Draga x Desiree",1,-,-,-,-,-,-,-,-,-,-,-,"Agrico UK Ltd","Castleton of Eassie",,"By Forfar",Angus,"DD8 1SJ","UNITED KINGDOM",potatoes@agrico.co.uk,www.agrico.co.uk,"+44 (0)1307 840551","+44 (0)1307 840245",2008,"Short - oval",Red,Cream,"Shallow - medium",Smooth,Pink,Maincrop,Medium,"Red violet",Absent,7,5,8,-,-,-,3,2,2,5,5,7,5,7,4,6,5,5,4,-,-,-,-
Rooster,"An excellent all-round potato combining beautiful taste with good yields.  Rooster produces excellent French fries and it is perfect for mashing and roasting.  As a special variety, careful seed handling is necessary for optimal crop results.  Susceptible to potato cyst nematode <i> Globodera rostochiensis </i> Ro1 and <i> globodera pallida </i> Pa2/3,1.  Tests show resistance to blackleg and potato leafroll virus.  ","OP 2532 64 x Pentland Ivory",1,"Teagasc Crops Research Centre","Oak Park Research Centre",,Carlow,,,IRELAND,,www.teagasc.ie,"+353 59 9170200","+353 59 9142423","Irish Potato Marketing Ltd","East Den Brae",,Letham,Angus,"DD8 2PJ","UNITED KINGDOM",info@ipmscotland.co.uk,www.ipm.ie,"+44 (0)1307 818121","+44 (0)1307 818131",2021,Oval,Red,"Medium yellow",Shallow,Medium,Violet,Maincrop,"Medium - tall","Red violet",Few,6,6,5,-,-,-,7,2,2,6,7,-,-,-,-,-,6,6,4,-,-,-,-
Roscor,"Trials have found good resistance to blackleg and potato virus Yo .Â Â Tests for resistance to potato cyst nematode demonstrated resistance to  <i>Globodera rostochiensis</i> Ro1  and susceptibility to <i>Globodera pallida</i> Pa 2/3, 1.","S 62 47 1 x Maris Piper",1,"Department of Agriculture for Northern Ireland","Newforge Lane",,Belfast,,,"UNITED KINGDOM",,,,,-,-,-,-,-,-,-,-,-,-,-,2024,Oval,Cream,Cream,Shallow,Smooth,Pink,"First Early",Short,"Red violet",Absent,5,3,9,-,-,-,6,2,9,4,7,-,-,-,-,-,-,5,4,-,-,-,-
Roseval,"An early maincrop salad variety bred in France and first marketed in UK in 1950.  Roseval produces long oval tubers with a deep red skin and a medium yellow, waxy flesh.","Vale x Rosa",1,-,-,-,-,-,-,-,-,-,-,-,"GB Seed Industry","These varieties are freely available and","sources can be found by clicking on the","national flags on each","variety description page.",,"UNITED KINGDOM",,,,,-,"Oval - long",Red,"Medium yellow","Very shallow - shallow",Smooth,Pink,Maincrop,"Tall - very tall","Red violet",Absent,-,-,-,-,-,-,-,-,-,-,-,-,-,-,-,-,-,-,-,-,-,-,-
Royal,"Royal is an early maincrop  variety.Â Â This variety  is suitable for both crisping  and french fries.Â Â Tubers have good  resistance to bruising and splitting.Â Â Trials have found good resistance to silver scurf, dry rot (<I>Fusarium coeruleum</I>) and potato mop top (spraing).Â Â This variety has low resistance to dry rot (<I>Fusarium sulphureum</I>), black dot and late blight on tubers.Â Â Tests for resistance to potato cyst nematode demonstrated resistance to  <i>Globodera rostochiensis</i> Ro1  and susceptibility to <i>Globodera pallida</i> Pa 2/3, 1.","Midas x 92-BUY-1",1,-,-,-,-,-,-,-,-,-,-,-,"McCain Potatoes",Pugeston,,Montrose,Angus,"DD10 9LF","UNITED KINGDOM",seedsales@mccain.co.uk,www.mccain.co.uk,"+44 (0)1674 830681","+44 (0)1674 830289",-,Oval,Yellow,"Light yellow",-,-,-,"Early Maincrop",-,-,-,6,7,-,-,-,-,-,3,9,5,6,1,8,5,7,2,6,2,5,-,-,-,-
"Royal Kidney","Trials have found good resistance to common scab. This variety has low resistance to late blight on foliage, late blight on tubers, potato leafroll virus and potato virus Yo. ",-,1,-,-,-,-,-,-,-,-,-,-,-,"GB Seed Industry","These varieties are freely available and","sources can be found by clicking on the","national flags on each","variety description page.",,"UNITED KINGDOM",,,,,-,"Oval - long",White,Cream,Shallow,Medium,Pink,"Second Early",Medium,White,Absent,-,-,3,-,-,-,3,-,-,7,-,-,5,-,-,-,-,2,2,-,-,-,-
Rubesse,"Tubers have weak  resistance to splitting and some  resistance to bruising.Â Â Trials have found strong resistance to both species of dry rot (<i> Fusarium coeruleum </i>) and (<i> Fusarium sulphureum </i>) and good resistance to potato leafroll virus.Â Â This variety has low resistance to late blight on tubers.Â Â Tests for resistance to potato cyst nematode demonstrated resistance to  <i>Globodera rostochiensis</i> Ro1  and susceptibility to <i>Globodera pallida</i> Pa 2/3, 1.","Symfonia x Chieftain ",1,"Cygnet PB Ltd","Blairfield Farm",,Milnathort,Kinross-shire,"KY13 OSG","UNITED KINGDOM",cygnetpb@harleys.co.uk,www.cygnetpb.com,"+44 (0)1577 862 929","+44 (0)1577 863 741","Cygnet PB Ltd","Blairfield Farm",,Milnathort,Kinross-shire,"KY13 OSG","UNITED KINGDOM",cygnetpb@harleys.co.uk,www.cygnetpb.com,"+44 (0)1577 862 929","+44 (0)1577 863 741",2039,"Oval - long",Red,Cream,"Shallow - medium",Smooth,Pink,"Early Maincrop","Medium - tall","Red violet",-,5,1,3,-,-,-,7,2,9,6,5,8,8,6,6,5,5,2,4,-,-,-,-
Rudolph,"Trials have found good resistance to dry rot (<i>Fusarium coeruleum</i>) and skin spot.Â Â This variety has low resistance to dry rot (<i>Fusarium sulphureum</i>) and late blight on tubers.Â Â Tests for resistance to potato cyst nematode demonstrated susceptibility to both <i>Globodera rostochiensis</i> Ro1  and <i>Globodera pallida</i> Pa 2/3, 1.","Chieftain x Stirling",1,"Agrico UK Ltd","Castleton of Eassie",,"By Forfar",Angus,"DD8 1SJ","UNITED KINGDOM",potatoes@agrico.co.uk,www.agrico.co.uk,"+44 (0)1307 840551","+44 (0)1307 840245","Agrico UK Ltd","Castleton of Eassie",,"By Forfar",Angus,"DD8 1SJ","UNITED KINGDOM",potatoes@agrico.co.uk,www.agrico.co.uk,"+44 (0)1307 840551","+44 (0)1307 840245",-,-,Red,-,-,-,Pink,"Early Maincrop","Medium - tall","Red violet",Medium,6,6,-,-,-,-,-,2,2,3,4,2,7,7,4,5,5,2,5,-,-,-,-
"Russet Burbank","Maincrop maturity with moderate yields.  High resistance to common scab.  Susceptible to potato cyst nematode <i> Globodera rostochiensis </i> Ro1 and <i> Globodera pallida </i> Pa2/3,1, drought with a tendency to produce misshapen tubers when moisture stress occurs.  Susceptible to tuber blight, foliage blight, mild mosaic virus, potato leaf roll virus and internal rust spot.  Medium to high dry matter with good fry colour.","Seedling of Early Rose",1,"Burbank USA",Farm,,"Santa Rosa",California,,"UNITED STATES",,,,,"GB Seed Industry","These varieties are freely available and","sources can be found by clicking on the","national flags on each","variety description page.",,"UNITED KINGDOM",,,,,-,Long,Cream,White,Deep,Medium,Pink,Maincrop,Tall,White,Absent,4,2,4,-,-,-,2,2,2,8,-,-,-,-,-,-,-,1,3,-,-,-,-
Safari,"Tubers have good  resistance to bruising and splitting.Â Â Trials have found good resistance to silver scurf and blackleg.Â Tests for resistance to potato cyst nematode demonstrated resistance to  <i>Globodera rostochiensis</i> Ro1  and susceptibility to <i>Globodera pallida</i> Pa 2/3, 1.","Obelix x Amadeus ",1,-,-,-,-,-,-,-,-,-,-,-,"Branston Ltd","Mere Road",Branston,Lincoln,Lincolnshire,"LN4 1NJ","UNITED KINGDOM",,,,,-,"Short - oval",Yellow,"Light yellow","Very shallow - shallow",Medium,-,Maincrop,Medium,White,Medium,6,6,-,-,-,-,-,2,7,4,8,6,6,5,8,6,4,3,5,-,-,-,-
Safiyah,"Safiyah is a second early variety for general purpose use.  Tubers have poor resistance to splitting and some resistance to bruising.Â Â Trials have found good resistance to potato leafroll virus, blackleg and dry rot. (<i>F. sulphureum</i>).Â This variety has low resistance to late blight on tubers.Â Â Tests for resistance to potato cyst nematode demonstrated resistance to  <i>Globodera rostochiensis</i> Ro1  and susceptibility to <i>Globodera pallida</i> Pa 2/3, 1.","Fabula x Felsina",1,"Higgins Agriculture Ltd","Greenbank House",Finningley,Doncaster,,"DN9 3BZ","UNITED KINGDOM",potatoes@higgins.co.uk,www.higgins.eu.com,"+44 (0)1302 770591","+44 (0)1302 770668",-,-,-,-,-,-,-,-,-,-,-,-,Oval,White,"Light yellow",Shallow,-,Pink,"Second Early","Short - medium","Red violet",Few,5,2,-,1,9,-,7,2,7,6,8,9,6,7,6,2,3,1,3,-,-,-,-
"Sagitta (2006)","Sagitta is an early maincrop variety for the general purpose market.  In trials the variety demonstrated resistance to dry rots (<i>F. sulphureum</i> and <i>F. coerulem</i>), mop top (spraing), PCN Ro1, silver scurf and splitting.  The variety had susceptibility to foliage and tuber late blight and PCN Pa2/3.","Gallia x RZ-86-2918",1,"HZPC Holland B.V.","Box 88",NL-8500,"AB Joure",,,NETHERLANDS,,,,,"HZPC UK Limited","2 Wharf Road",Crowle,Scunthorpe,"North Lincolnshire","DN17 4HS","UNITED KINGDOM",info.uk@hzpc.com,www.hzpc.co.uk,"+44 (0)1724 71 00 33","+44 (0)1724 71 00 99",2036,Oval,Yellow,"Light yellow",-,-,-,"Early Maincrop",-,"Red violet",-,6,7,-,-,-,8,-,2,8,6,6,9,7,5,7,4,4,2,3,-,-,-,-
Sandpiper,"Tubers have good  resistance to splitting.Â Â Trials have found good resistance to blackleg and potato virus Yo .Â Â This variety has low resistance to late blight on tubers and foliage.Â Â Tests for resistance to potato cyst nematode demonstrated susceptibility to both <i>Globodera rostochiensis</i> Ro1  and <i>Globodera pallida</i> Pa 2/3, 1.","Wischip x Bonaparte",1,"Robert Hoopes","4295 Tenderfoot Road",,Rhinelander,,"WI 54501","UNITED STATES",,,,,Pepsico,"c/o Cambridge University Farm","Huntingdon Road",Girton,Cambridge,"CB3 0LH","UNITED KINGDOM",,,,,2036,"Short - oval",White,"Light yellow","Shallow - medium",Smooth,Pink,"Early Maincrop",Short,White,Absent,3,7,8,-,-,-,5,3,2,5,8,-,-,-,-,-,3,1,3,-,-,-,-
Sante,"Suitable for pre-pack, processing and general ware. Most commonly grown organic variety.  Susceptible to silver scurf, skin spot and blackleg.  Tests show resistance to Dry rot <i> Fusarium sulphureum </i>, powdery scab, potato leafroll virus, potato virus Yo and bruising.  Tests for potato cyst nematode shows it is resistant to <i> Globodera rostochiensis </i> Ro1 and susceptible to <i> Globodera pallida </i> Pa2/3,1. ","WY 66-13-636 x AM 66-42",1,-,-,-,-,-,-,-,-,-,-,-,"Agrico UK Ltd","Castleton of Eassie",,"By Forfar",Angus,"DD8 1SJ","UNITED KINGDOM",potatoes@agrico.co.uk,www.agrico.co.uk,"+44 (0)1307 840551","+44 (0)1307 840245",2015,"Short - oval",Cream,"Light yellow","Shallow - medium",Smooth,Pink,Maincrop,Medium,White,Absent,7,6,8,-,-,-,8,4,9,6,3,7,6,3,3,5,8,6,4,-,-,-,-
Saphire,"Trials have found strong resistance to blackleg.Â Â This variety has low resistance to dry rot (<i>Fusarium sulphureum</i>).Â Â Tests for resistance to potato cyst nematode demonstrated susceptibility to  <i>Globodera rostochiensis</i> Ro1  and susceptibility to <i>Globodera pallida</i> Pa 2/3, 1.","Bydand x Caesar",1,"Handelmij Van Rijn BV","Postbus 98",,Poeldijk,,"2685 DG",NETHERLANDS,,,"+31 (0) 174  41 94 00","+31 (0) 174  42 01 39",-,-,-,-,-,-,-,-,-,-,-,2035,"Short - oval",White,-,Shallow,-,Pink,"Early Maincrop",-,White,-,6,6,-,-,-,-,-,3,4,6,9,1,5,6,6,5,4,4,4,-,-,-,-
"Sarpo Gwyn","Tubers have good  resistance to splitting, silver scurf and skin spot.Â Â This variety has low resistance to dry rot (<i>Fusarium sulphureum</i>) and blackleg.Â Â The variety has some level of resistance to foliage late blight, powdery scab, black dot, common scab, virus Yo and bruising.  Tests for resistance to potato cyst nematode demonstrated resistance to  <i>Globodera rostochiensis</i> Ro1  and susceptibility to <i>Globodera pallida</i> Pa 2/3, 1.  ","76.P.012 14268 x 79D 2152.3002",1,"SÃ¡rvÃ¡ri Research Trust","Siambra Gwynion Llandygai",,Bangor,,"LL57 4BG","UNITED KINGDOM",info@sarvari-trust.org,www.sarvari-trust.org,"+44 (0)1248 364260","+44 (0)1248 681730",-,-,-,-,-,-,-,-,-,-,-,2040,Oval,White,Cream,Shallow,-,Pink,Maincrop,Tall,White,-,6,7,6,-,-,-,5,2,9,6,3,1,4,7,7,6,6,5,6,-,-,-,-
"Sarpo Mira"," Trials have found good resistance to blackleg, late blight on foliage, late blight on tubers and potato virus Yo.  Tests for resistance to potato cyst nematode demonstrated susceptibility to both <i>Globodera rostochiensis</i> Ro1  and <i>Globodera pallida</i> Pa 2/3, 1.","76 PO 12 14 268 x D187",1,"Sarvari Research Trust",Llandeydai,,Bangor,,,"UNITED KINGDOM",,,,,"Danespo A/S","Ryttervangen 1",,Give,,"DK - 7323",DENMARK,danespo@danespo.com,,"+45 75 73 59 00",,2034,"Oval - long",Red,White,"Shallow - medium",Smooth,Pink,Maincrop,-,"Red violet",Few,6,3,9,-,-,-,5,2,2,4,7,-,-,-,-,-,5,9,7,-,-,-,-
"Sarpo Shona","Trials have found good resistance to black dot, powdery scab and potato virus Yo. Â This variety has low resistance to dry rot (<i>Fusarium sulphureum</i>).Â Â Tests for resistance to potato cyst nematode demonstrated susceptibility to both <i>Globodera rostochiensis</i> Ro1  and <i>Globodera pallida</i> Pa 2/3, 1.","87.41.1090 x 84.13.2 ",1,"SÃ¡rvÃ¡ri Research Trust","Siambra Gwynion Llandygai",,Bangor,,"LL57 4BG","UNITED KINGDOM",info@sarvari-trust.org,www.sarvari-trust.org,"+44 (0)1248 364260","+44 (0)1248 681730",-,-,-,-,-,-,-,-,-,-,-,-,-,-,-,-,-,-,-,-,-,-,5,3,-,-,-,-,-,-,-,5,-,-,-,-,-,-,-,4,7,-,-,-,-
